{
  "minimalStateOfHealth" : {
    "minimalStateOfHealthValue" : 38984.72181542653,
    "specificatorId" : "OEM",
    "minimalStateOfHealthPhase" : "as specified by OEM"
  },
  "currentStateOfHealth" : [ {
    "currentStateOfHealthPhase" : "as specified by OEM",
    "currentStateOfHealthValue" : 52274.25581093203,
    "currentStateOfHealthTimestamp" : "2022-04-01T12:00:00Z"
  }, {
    "currentStateOfHealthPhase" : "as recieved by dismantling",
    "currentStateOfHealthValue" : 9504.684367924747,
    "currentStateOfHealthTimestamp" : "2022-04-01T12:00:00Z"
  } ],
  "performanceIndicator" : {
    "electricCapacityMin" : 26212.182226034147,
    "electricCapacityMax" : 3117.732935335289
  },
  "type" : "LVB"
}